{
  "meta": {
    "id": "study",
    "name": "勉強トラッカー",
    "version": "1.0.0",
    "description": "教科別の学習量を可視化・管理するプリセット"
  },
  "theme": {
    "secondary":            { "light": "#1565C0", "dark": "#82B1FF" },
    "secondaryContainer":   { "light": "#BBDEFB", "dark": "#0D47A1" },
    "onSecondaryContainer": { "light": "#0D47A1", "dark": "#BBDEFB" },
    "tertiary":             { "light": "#00897B", "dark": "#80CBC4" },
    "tertiaryContainer":    { "light": "#B2DFDB", "dark": "#004D40" },
    "onAccent":             { "light": "#FFFFFF", "dark": "#1A1A1A" }
  },
  "labels": {
    "entries": { "ja": "学習内容", "en": "Topics" },
    "groups": { "ja": "学習プラン", "en": "Study Plans" },
    "notes": { "ja": "学習法", "en": "Methods" }
  },
  "counters": [
    { "id": "math",     "name": { "ja": "数学",   "en": "Math" },            "shortName": "数", "max": 100, "recommended": 30, "goalValue": 20, "defaultDirection": "up", "includeInTotal": true, "unit": { "ja": "コマ", "en": "sessions" }, "milestones": [
      { "label": { "ja": "基礎", "en": "Basic" }, "value": 10 },
      { "label": { "ja": "標準", "en": "Standard" }, "value": 20 },
      { "label": { "ja": "発展", "en": "Advanced" }, "value": 40 },
      { "label": { "ja": "完成", "en": "Mastery" }, "value": 80 }
    ]},
    { "id": "english",  "name": { "ja": "英語",   "en": "English" },         "shortName": "英", "max": 100, "recommended": 30, "goalValue": 20, "defaultDirection": "up", "includeInTotal": true, "unit": { "ja": "コマ", "en": "sessions" }, "milestones": [
      { "label": { "ja": "基礎", "en": "Basic" }, "value": 10 },
      { "label": { "ja": "標準", "en": "Standard" }, "value": 20 },
      { "label": { "ja": "発展", "en": "Advanced" }, "value": 40 },
      { "label": { "ja": "完成", "en": "Mastery" }, "value": 80 }
    ]},
    { "id": "science",  "name": { "ja": "理科",   "en": "Science" },         "shortName": "理", "max": 100, "recommended": 25, "goalValue": 15, "defaultDirection": "up", "includeInTotal": true, "unit": { "ja": "コマ", "en": "sessions" }, "milestones": [
      { "label": { "ja": "基礎", "en": "Basic" }, "value": 8 },
      { "label": { "ja": "標準", "en": "Standard" }, "value": 15 },
      { "label": { "ja": "発展", "en": "Advanced" }, "value": 30 },
      { "label": { "ja": "完成", "en": "Mastery" }, "value": 60 }
    ]},
    { "id": "social",   "name": { "ja": "社会",   "en": "Social Studies" },  "shortName": "社", "max": 100, "recommended": 25, "goalValue": 15, "defaultDirection": "up", "includeInTotal": true, "unit": { "ja": "コマ", "en": "sessions" }, "milestones": [
      { "label": { "ja": "基礎", "en": "Basic" }, "value": 8 },
      { "label": { "ja": "標準", "en": "Standard" }, "value": 15 },
      { "label": { "ja": "発展", "en": "Advanced" }, "value": 30 },
      { "label": { "ja": "完成", "en": "Mastery" }, "value": 60 }
    ]},
    { "id": "japanese", "name": { "ja": "国語",   "en": "Japanese" },        "shortName": "国", "max": 100, "recommended": 20, "goalValue": 12, "defaultDirection": "up", "includeInTotal": true, "unit": { "ja": "コマ", "en": "sessions" }, "milestones": [
      { "label": { "ja": "基礎", "en": "Basic" }, "value": 6 },
      { "label": { "ja": "標準", "en": "Standard" }, "value": 12 },
      { "label": { "ja": "発展", "en": "Advanced" }, "value": 25 },
      { "label": { "ja": "完成", "en": "Mastery" }, "value": 50 }
    ]}
  ],
  "totalMax": 500,
  "multipliers": [],
  "multiplierStacking": "multiplicative",
  "items": [],
  "itemsAffectedByMultipliers": false,
  "manualSteps": {
    "increments": [1, 2, 3],
    "decrements": [1]
  },
  "database": {
    "entries": [
      { "id": "calc-drill",       "sortOrder": 1,  "name": { "ja": "計算ドリル",       "en": "Calculation Drill" },         "values": { "math": 1 },     "tags": ["math", "basic"] },
      { "id": "word-problems",    "sortOrder": 2,  "name": { "ja": "文章問題",          "en": "Word Problems" },             "values": { "math": 1 },     "tags": ["math", "applied"] },
      { "id": "geometry",         "sortOrder": 3,  "name": { "ja": "図形・幾何",        "en": "Geometry" },                  "values": { "math": 1 },     "tags": ["math"] },
      { "id": "functions",        "sortOrder": 4,  "name": { "ja": "関数・グラフ",      "en": "Functions & Graphs" },        "values": { "math": 1 },     "tags": ["math"] },
      { "id": "equations",        "sortOrder": 5,  "name": { "ja": "方程式・不等式",    "en": "Equations & Inequalities" },  "values": { "math": 1 },     "tags": ["math"] },
      { "id": "probability",      "sortOrder": 6,  "name": { "ja": "確率・統計",        "en": "Probability & Statistics" },  "values": { "math": 1 },     "tags": ["math", "applied"] },
      { "id": "math-exam-prep",   "sortOrder": 7,  "name": { "ja": "数学 過去問演習",   "en": "Math Past Exams" },           "values": { "math": 1 },     "tags": ["math", "exam"] },

      { "id": "vocabulary",       "sortOrder": 10, "name": { "ja": "英単語・熟語暗記",  "en": "Vocabulary & Idioms" },       "values": { "english": 1 },  "tags": ["english", "basic"] },
      { "id": "grammar",          "sortOrder": 11, "name": { "ja": "英文法演習",        "en": "Grammar Practice" },          "values": { "english": 1 },  "tags": ["english", "basic"] },
      { "id": "reading-comp",     "sortOrder": 12, "name": { "ja": "長文読解",          "en": "Reading Comprehension" },     "values": { "english": 1 },  "tags": ["english", "applied"] },
      { "id": "listening",        "sortOrder": 13, "name": { "ja": "リスニング",        "en": "Listening Practice" },        "values": { "english": 1 },  "tags": ["english"] },
      { "id": "composition",      "sortOrder": 14, "name": { "ja": "英作文",            "en": "English Composition" },       "values": { "english": 1 },  "tags": ["english", "applied"] },
      { "id": "eng-exam-prep",    "sortOrder": 15, "name": { "ja": "英語 過去問演習",   "en": "English Past Exams" },        "values": { "english": 1 },  "tags": ["english", "exam"] },

      { "id": "physics",          "sortOrder": 20, "name": { "ja": "物理演習",          "en": "Physics Problems" },          "values": { "science": 1 },  "tags": ["science"] },
      { "id": "chemistry",        "sortOrder": 21, "name": { "ja": "化学演習",          "en": "Chemistry Problems" },        "values": { "science": 1 },  "tags": ["science"] },
      { "id": "biology",          "sortOrder": 22, "name": { "ja": "生物学習",          "en": "Biology Study" },             "values": { "science": 1 },  "tags": ["science"] },
      { "id": "earth-science",    "sortOrder": 23, "name": { "ja": "地学学習",          "en": "Earth Science" },             "values": { "science": 1 },  "tags": ["science"] },
      { "id": "sci-lab-report",   "sortOrder": 24, "name": { "ja": "実験レポート",      "en": "Lab Report" },                "values": { "science": 1 },  "tags": ["science", "applied"] },
      { "id": "sci-exam-prep",    "sortOrder": 25, "name": { "ja": "理科 過去問演習",   "en": "Science Past Exams" },        "values": { "science": 1 },  "tags": ["science", "exam"] },

      { "id": "jp-history",       "sortOrder": 30, "name": { "ja": "日本史学習",        "en": "Japanese History" },          "values": { "social": 1 },   "tags": ["social"] },
      { "id": "world-history",    "sortOrder": 31, "name": { "ja": "世界史学習",        "en": "World History" },             "values": { "social": 1 },   "tags": ["social"] },
      { "id": "geography",        "sortOrder": 32, "name": { "ja": "地理学習",          "en": "Geography" },                 "values": { "social": 1 },   "tags": ["social"] },
      { "id": "civics",           "sortOrder": 33, "name": { "ja": "公民・政経",        "en": "Civics & Economics" },        "values": { "social": 1 },   "tags": ["social"] },
      { "id": "current-events",   "sortOrder": 34, "name": { "ja": "時事問題",          "en": "Current Events" },            "values": { "social": 1 },   "tags": ["social", "applied"] },
      { "id": "soc-exam-prep",    "sortOrder": 35, "name": { "ja": "社会 過去問演習",   "en": "Social Studies Past Exams" }, "values": { "social": 1 },   "tags": ["social", "exam"] },

      { "id": "kanji",            "sortOrder": 40, "name": { "ja": "漢字練習",          "en": "Kanji Practice" },            "values": { "japanese": 1 }, "tags": ["japanese", "basic"] },
      { "id": "modern-reading",   "sortOrder": 41, "name": { "ja": "現代文読解",        "en": "Modern Text Reading" },       "values": { "japanese": 1 }, "tags": ["japanese"] },
      { "id": "classical-grammar","sortOrder": 42, "name": { "ja": "古典文法",          "en": "Classical Grammar" },         "values": { "japanese": 1 }, "tags": ["japanese"] },
      { "id": "classical-reading","sortOrder": 43, "name": { "ja": "古文読解",          "en": "Classical Text Reading" },    "values": { "japanese": 1 }, "tags": ["japanese"] },
      { "id": "essay-writing",    "sortOrder": 44, "name": { "ja": "小論文・作文",      "en": "Essay Writing" },             "values": { "japanese": 1 }, "tags": ["japanese", "applied"] },
      { "id": "jpn-exam-prep",    "sortOrder": 45, "name": { "ja": "国語 過去問演習",   "en": "Japanese Past Exams" },       "values": { "japanese": 1 }, "tags": ["japanese", "exam"] }
    ],
    "groups": [
      {
        "id": "weekday-morning",
        "name": { "ja": "平日朝学習（30分）", "en": "Weekday Morning (30 min)" },
        "location": { "ja": "毎日ルーティン", "en": "Daily Routine" },
        "members": [
          { "name": { "ja": "英単語・熟語暗記", "en": "Vocabulary & Idioms" }, "level": 1, "values": { "english": 1 } },
          { "name": { "ja": "計算ドリル",       "en": "Calculation Drill" },   "level": 1, "values": { "math": 1 } }
        ],
        "totalValues": { "english": 1, "math": 1 },
        "rematchable": true
      },
      {
        "id": "after-school",
        "name": { "ja": "放課後集中（2時間）", "en": "After School Focus (2h)" },
        "location": { "ja": "平日", "en": "Weekdays" },
        "members": [
          { "name": { "ja": "文章問題",    "en": "Word Problems" },           "level": 1, "values": { "math": 1 } },